<?xml version="1.0" encoding="UTF-8"?>
<!-- edited with XMLSpy v2005 U (http://www.xmlspy.com) by Patrick Alan McConnell (Duke University) -->
<xs:schema xmlns:xs="http://www.w3.org/2001/XMLSchema" elementFormDefault="qualified" attributeFormDefault="unqualified">
	<xs:element name="CqlNodeSet">
		<xs:annotation>
			<xs:documentation>Comment describing your root element</xs:documentation>
		</xs:annotation>
		<xs:complexType>
			<xs:sequence>
				<xs:element name="CqlNode" maxOccurs="unbounded">
					<xs:complexType>
						<xs:complexContent>
							<xs:extension base="CqlNodeType"/>
						</xs:complexContent>
					</xs:complexType>
				</xs:element>
			</xs:sequence>
		</xs:complexType>
	</xs:element>
	<xs:complexType name="CqlNodeType">
		<xs:complexContent>
			<xs:extension base="CqlMapType">
				<xs:sequence>
					<xs:element name="CqlProperty" type="CqlPropertiesType" minOccurs="0" maxOccurs="unbounded"/>
					<xs:element name="CqlNode" type="CqlNodeType" minOccurs="0" maxOccurs="unbounded"/>
				</xs:sequence>
			</xs:extension>
		</xs:complexContent>
	</xs:complexType>
	<xs:complexType name="CqlMapType">
		<xs:attribute name="cqlName" type="xs:string" use="required"/>
		<xs:attribute name="xmlName" type="xs:string" use="required"/>
		<xs:attribute name="xmlPath" type="xs:string" use="optional"/>
	</xs:complexType>
	<xs:complexType name="CqlPropertiesType">
		<xs:complexContent>
			<xs:extension base="CqlMapType"/>
		</xs:complexContent>
	</xs:complexType>
</xs:schema>
