<?xml version="1.0" encoding="UTF-8"?>
<!--Sample XML file generated by XMLSpy v2005 U (http://www.xmlspy.com)-->
<CqlNodeSet xmlns:xsi="http://www.w3.org/2001/XMLSchema-instance" xsi:noNamespaceSchemaLocation="CqlXpathMap.xsd">
	<CqlNode xmlName="scanFeatures" cqlName="edu.duke.cabig.scanFeatures.ScanFeatures">
		<CqlProperty xmlName="lsid" cqlName="lsid"/>
		<CqlNode xmlName="attributes" cqlName="edu.duke.cabig.scanFeatures.Attributes">
			<CqlProperty xmlName="project" cqlName="project"/>
			<CqlProperty xmlName="patientID" cqlName="patientID"/>
			<CqlProperty xmlName="fractionNumber" cqlName="fractionNumber"/>
			<CqlProperty xmlName="biologicalReplicate" cqlName="biologicalReplicate"/>
			<CqlProperty xmlName="technicalReplicate" cqlName="technicalReplicate"/>
			<CqlProperty xmlName="date" cqlName="date"/>
			<CqlProperty xmlName="outcome" cqlName="outcome"/>
			<CqlProperty xmlName="scanNumber" cqlName="scanNumber"/>
			<CqlProperty xmlName="processingStep" cqlName="processingStep"/>
			<CqlProperty xmlName="lcRetentionTime" cqlName="lcRetentionTime"/>
			<CqlProperty xmlName="experimentalDataLSID" cqlName="experimentalDataLSID"/>
			<CqlProperty xmlName="scanStartPos" cqlName="scanStartPos"/>
			<CqlProperty xmlName="scanStepSize" cqlName="scanStepSize"/>
		</CqlNode>
		<CqlNode xmlName="feature" cqlName="edu.duke.cabig.scanFeatures.Feature">
			<CqlProperty xmlName="@name" cqlName="name"/>
			<CqlNode xmlName="base64" cqlName="edu.duke.cabig.scanFeatures.Base64">
				<CqlProperty xmlName="@type" cqlName="type"/>
				<CqlProperty xmlName="@count" cqlName="type"/>
				<CqlProperty xmlName="." cqlName="value"/>
			</CqlNode>
		</CqlNode>
	</CqlNode>
</CqlNodeSet>
